id,name,text,trans
0000000000000,星南,プロデューサー！\nさっそくだけれど――,制作人！\n虽然有点突然――
0000000000000,星南,ことねのプロデュース<r\=プラン>計画</r>について、\nしっかり考えておきたいわ。,我想好好考虑一下\n关于琴音的培育计划。
0000000000000,{user},案がありそうですね。\nうかがいましょう。,看来你已经有方案了。\n请说说看吧。
0000000000000,星南,あの子にも『Campus mode!!』を\n習得してもらおうと思っているの。,我想让那孩子也学会\n『Campus mode!!』。
0000000000000,{user},<em>まだ持ち歌がない</em>初星アイドルに\nとっては、最適な楽曲ですからね。,对于还没有代表曲的初星偶像来说，\n这是最合适的歌曲了。
0000000000000,星南,ええ……前回のミーティングで\n話した通りよ。,嗯……正如上次会议中\n提到的那样。
0000000000000,星南,加えて、手取り足取り……\n私みずから教えることもできる。,而且，我可以手把手……\n亲自教导她。
0000000000000,{user},よこしまな意図が見え隠れするのは\nさておき、いい案ですね。,暂且不论你那隐约可见的\n不良意图，这确实是个好主意。
0000000000000,{user},十王星南の\n『Campus mode!!』は、\n熟練の域に達していますから。,十王星南的\n『Campus mode!!』，\n已经达到了熟练的境界。
0000000000000,星南,私以上に、初星学園と密接に\n関わってきたアイドルはいないもの。,没有谁比我更了解\n初星学园了。
0000000000000,星南,あの曲は誰よりも練習してきたわ。\n胸を張ってこう言える――得意曲よ。,那首歌我练习得比谁都多。\n我可以自豪地说――这是我的拿手曲目。
0000000000000,星南,『Campus mode!!』で、\n同胞を導き、トップアイドルに挑む。,用『Campus mode!!』，\n引导同伴，挑战顶级偶像。
0000000000000,星南,自分で言うのもなんだけれど、\n強力なプランではないかしら。,虽然自己这么说有点奇怪，\n但这不就是一个强有力的计划吗？
0000000000000,{user},藤田ことね育成計画その1は、\n『Campus mode!!』の習得。,藤田琴音培育计划第一步，\n学会『Campus mode!!』。
0000000000000,{user},その2以降の案はありますか？,第二步及之后的计划有吗？
0000000000000,星南,もちろん。その2は――そうね。\nことねとは、一度……,当然。第二步是――嗯。\n我想和琴音好好谈谈……
0000000000000,星南,『ファンサ』について\nきちんと話しておきたいわ。,关于『粉丝互动』的事情。
0000000000000,星南,彼女のファンサはすでに、全校生徒の\n中でも高い水準にあるけれど。,她的粉丝互动水平在全校学生中\n已经算是很高的了。
0000000000000,星南,一方で、当たり前のテクニックが\n抜け落ちていることがある。,但另一方面，有些基本的技巧\n却有所欠缺。
0000000000000,星南,チグハグさの原因を特定できたなら、\nあの子はまた1つ上に行けるわ。,如果能找出这些不协调的原因，\n她还能再上一个台阶。
0000000000000,星南,その過程で……ファンを大いに\n盛り上げ夢中にさせる……,在这个过程中……让粉丝们\n更加兴奋和投入……
0000000000000,星南,藤田ことねが持つ、あの『熱』を、\nすこしでも学ぶことができれば……,如果能稍微学到藤田琴音\n那种『热情』的话……
0000000000000,星南,フフ……楽しみね。私の目の前で\nファンサをしてもらう日が。,呵呵……真期待啊。她在我面前\n表演粉丝互动的那一天。
0000000000000,{user},よこしまな意図が見え隠れするのは\nさておき、いい案ですね。,暂且不论你那隐约可见的\n不良意图，这确实是个好主意。
0000000000000,星南,さっきから一言多いわねあなた。,你从刚才开始就话有点多啊。
0000000000000,{user},では、その3はこちらから。,那么，第三步由我来说。
0000000000000,{user},藤田さんは、ご家族をとても大切に\nしているようです。,藤田同学似乎非常\n重视她的家人。
0000000000000,{user},彼女の家族を、ライブ会場に\nお呼びするのはどうでしょう。,不如邀请她的家人\n来参加演唱会怎么样？
0000000000000,星南,うーん……効果があるかしら？,嗯……会有效果吗？
0000000000000,{user},てきめんにあると思いますよ。\nピンときませんか？,我觉得效果会立竿见影。\n你不觉得吗？
0000000000000,星南,そうね……私自身、家族の来場でなにか\nが変わるイメージが湧かないわ。,是啊……我自己也想象不出\n家人到场会带来什么变化。
0000000000000,星南,……ひとまず、こんなところかしら。\nいいミーティングができたわね。,……暂时就到这里吧。\n这次会议很顺利呢。
0000000000000,{user},星南さん、聞いてもいいでしょうか？,星南同学，可以问你一个问题吗？
0000000000000,星南,私に答えられることなら。,如果是我能回答的事情的话。
0000000000000,{user},星南さんのご家族についてです。,是关于星南同学的家人。
0000000000000,星南,フフ……さっき私が、,呵呵……刚才我，
0000000000000,星南,家族の来場について、反応が\n悪かったのを気にしているの？,对家人来场的反应不太好，\n你在意这个吗？
0000000000000,星南,安心して頂戴。関係は良好よ。,请放心。我们的关系很好。
0000000000000,星南,学園長……祖父以外とは、忙しくて\nあまり会えていないだけ。,除了学园长……我的祖父以外，\n因为太忙，所以很少见面。
0000000000000,星南,まあ……長く離れて暮らしていると、\n久しぶりに会っても……,不过……长时间分开生活的话，\n即使久别重逢……
0000000000000,星南,なにを話していいか、\n困ってしまうのだけど。,也会不知道该聊什么，\n有点困扰呢。
0000000000000,星南,そう珍しい話でもないでしょう？,这也不是什么稀奇的事吧？
0000000000000,{user},……<em\=>ふむ</em>。,……嗯。
0000000000000,{user},星南さんのお父さん……十王社長に\nついて聞いてもいいでしょうか？,可以问一下星南同学的父亲……\n十王社长的事吗？
0000000000000,星南,あら、未来の上司が気になるの？,哎呀，未来的上司让你在意吗？
0000000000000,{user},学園長が、初星学園も一枚岩ではない\n……と、言っていたので。,因为学园长说，\n初星学园也不是铁板一块……
0000000000000,星南,よくある親子喧嘩よ。あまり重く\n受け止めないでいいわ。,只是普通的父子吵架而已。\n不用太在意。
0000000000000,{user},十王社長は、\n黒井氏と交流があるようですね。,十王社长似乎和黑井先生有来往呢。
0000000000000,星南,ええ、ただ……\n少なくとも仲良し、ではないと思う。,是的，不过……\n至少我觉得他们关系并不好。
0000000000000,星南,ふたりが険悪な会話をしているところ、\n何度も見たもの。,我见过好几次他们进行不愉快的对话。
0000000000000,{user},……星南さん自身から見た、\n十王社長の印象を聞いても？,……可以听听星南同学本人对十王社长的印象吗？
0000000000000,星南,いいけれど……あなたがそんなに\n興味を持つなんて珍しいわね。,可以啊……不过你这么感兴趣还真是少见呢。
0000000000000,{user},近々、お会いする機会が\nあるかもしれないので。,因为最近可能会有机会见到他。
0000000000000,星南,そういうことなら……そうね……,如果是这样的话……嗯……
0000000000000,星南,彼の印象は……有能な人。狡猾な人。\n回りくどい策を練る人。,他的印象是……有能力的人。狡猾的人。\n喜欢制定迂回策略的人。
0000000000000,星南,強者の風格があって、\n対面すると圧を感じる人。,有着强者的风范，\n面对他时会感到压力。
0000000000000,星南,一度目をかけたアイドルには、\nとても執着し、決して手放さない人。,一旦看中的偶像，\n就会非常执着，绝不放手的人。
0000000000000,{user},（……すこし星南さんに似ているな）,（……有点像星南同学呢）
0000000000000,星南,フフ……すこしだけ、\nあなたに似ているかも。,呵呵……也许有点像你哦。
0000000000000,{user},……どういうところが、でしょう？,……哪里像呢？
0000000000000,星南,その、なにもかもお見通しですよ――\nと、いわんばかりのすまし顔。,就是那种，仿佛一切都在掌握之中——\n的表情。
0000000000000,星南,例の謝罪会見。珍しく額に汗を\nかいていたわね。――痛快だったわ。,那次道歉发布会。\n你罕见地额头冒汗了呢。——真是痛快。
0000000000000,{user},……それは社長の話ですか？　\nあなたのプロデューサーの話ですか？,……这是在说社长吗？\n还是在说你的制作人？
0000000000000,星南,どちらもよ。それで……\nあらこのふたり、似ているわねって。,两者都是。所以……\n我就觉得这两个人有点像呢。
0000000000000,星南,ふふっ……これからは、\nお兄様って呼びましょうか？,呵呵……以后叫你哥哥怎么样？
info,adv_cidol-jsna-3-002_02.txt,,
译者,deepseek-chat,,
