id,name,text,trans
0000000000000,手毬,うぅ……さむっ。,呜……好冷啊。
0000000000000,手毬,見ましたか、1階に\n飾られてる雛人形。,你看到一楼\n摆着的雏人偶了吗？
0000000000000,手毬,もう3月なのに……いい加減、\nあったかくなってくれないかな……,都已经三月了……真希望能赶快\n暖和起来……
0000000000000,{user},いつの間にか、\nそんな季節になっていましたか。,不知不觉间，\n已经是这样的季节了啊。
0000000000000,{user},月村さん。思えば我々も、\n長い付き合いになってきましたね。,月村小姐。仔细想想，我们也\n认识很久了呢。
0000000000000,手毬,……どうしたんですか急に。\n気持ち悪いんですけど。,……你怎么突然这样说。\n感觉有点怪怪的。
0000000000000,{user},より良いプロデュースをするために、\nあなたのことを深く知りたい。,为了更好地培育你，\n我想更深入地了解你。
0000000000000,{user},聞かせてください――\n月村手毬の昔話を。,请告诉我——\n月村手毬的过去。
0000000000000,手毬,そっ……そんなこと……\n急に……言われても。,那……那种事情……\n突然……让我怎么说好。
0000000000000,手毬,なんの話をしたらいいんですか……,要我说些什么呢……
0000000000000,{user},アイドル・月村手毬の<r\=ルーツ>根源</r>に\n関わるエピソードがいいですね。,关于偶像·月村手毬\n根源的故事就好。
0000000000000,手毬,それ、以前、話しましたよね。\n……すこしだけ。,这个，我以前讲过了吧。\n……稍微讲过一点。
0000000000000,{user},もうすこしだけ、聞きたいです。\nあなたのことを。,我还想再听一点。\n关于你的。
0000000000000,手毬,押しが強いな。,你真够执着的。
0000000000000,手毬,……ふーん。\nそんなに興味があるんだ、私のこと。,……嗯。\n你对我这么感兴趣啊。
0000000000000,手毬,なら、また……すこしだけ。\n話してあげます。,那我就……再稍微\n讲一点给你听吧。
0000000000000,手毬,アイドル・月村手毬の始まりは……,偶像·月村手毬的开始是……
0000000000000,手毬,私がまだ小学生だった頃に観た、\n『H.I.F』のステージです。,我还在小学的时候看的，\n‘H.I.F’的舞台。
0000000000000,手毬,元々……テレビで歌うアイドルを見て、\n好きではあったんですけど。,原本……在电视上看到唱歌的偶像，\n我就挺喜欢的。
0000000000000,手毬,本気で目指そうとか、\n自分がなれるとか……,但从没认真想过要成为偶像，\n也没觉得自己能做到……
0000000000000,手毬,そういうふうには思ってなくて。\n本当に、たまたまだったんです。,真的只是偶然罢了。
0000000000000,手毬,美鈴のお母さんが、\nふたりぶんのチケットをくださって。,美铃的妈妈给了我们\n两张票。
0000000000000,{user},小学生ふたりで、京都から初星学園に？,两个小学生，从京都到初星学园？
0000000000000,手毬,あ、いえ、家族旅行のついでに……\n私と美鈴、親同士が仲いいので。,啊，不是，是趁着家庭旅行……\n我和美铃，家长们关系很好。
0000000000000,手毬,まりちゃんがテレビで見てたやつ、\nチケットあるよって。,"她说，""小麻莉看电视的那个，\n有票哦""。"
0000000000000,手毬,美鈴と行ってきたら、って。,于是就让我们一起去了。
0000000000000,手毬,渡されたのが『H.I.F』の\nチケットでした。,给我们的就是‘H.I.F’的\n票。
0000000000000,手毬,当日、出発する時間になっても、\n美鈴がぜんぜん起きてくれなくて……,当天，到了出发的时间，\n美铃还一直没醒……
0000000000000,手毬,あの子の手を引いて、\n走っていたのを覚えています。,我记得我拉着她的手，\n一路跑过去的。
0000000000000,手毬,初星学園についたときには、もう、\n決着はついちゃってて。,到了初星学园时，比赛\n已经结束了。
0000000000000,手毬,もうすぐ優勝ライブが\nはじまりますって、放送が流れてて。,"广播里说着，""优胜演唱会\n马上就要开始了""。"
0000000000000,手毬,息は切れるし、学園は広くて\n道がわからないし、,我累得气喘吁吁，学园又大，\n路也不认识，
0000000000000,手毬,美鈴は、興味なさそうに\nあくびをしてばっかりで……,美铃看起来一点兴趣也没有，\n一直在打哈欠……
0000000000000,手毬,せっかく来たのに～～～って、\n困っていたら。,我正想着，好不容易来了却——的时候。
0000000000000,？？？,――ねぇっ、あなたたちも、\nライブを観にきたの！？,——嘿，你们也是\n来看演唱会的吗！？
0000000000000,手毬,それが……,就是这样……
0000000000000,手毬,私たち、\n『SyngUp!』の出会いでした。,我们遇到了\n‘SyngUp!’。
info,adv_cidol-ttmr-3-009_01.txt,,
译者,gpt-4o,,