id,name,text,trans
0000000000000,星南,ゲームセンターって、本当に\nいろんなゲームがあるのね。,游戏中心真的有很多\n各种各样的游戏呢。
0000000000000,星南,あれは……車のゲーム？,那个是……赛车游戏？
0000000000000,{user},はい。\n車を運転して、レースをするんです。,是的。\n驾驶赛车，进行比赛。
0000000000000,星南,面白そうね。,听起来很有趣呢。
0000000000000,星南,いつか、自分で運転してみたいと\n思っていたのよ。,我一直想有一天\n自己试试开车。
0000000000000,星南,実際に免許を取る前の、\n予行練習にもなるかしら。,也许可以在考驾照之前，\n当作预演练习。
select,,試してみますか？,要试试看吗？
select,,やめて\nおきましょう,还是算了吧
0000000000000,{user},予行練習になるかどうかは\nわかりませんが。,不知道能不能当作预演练习。
0000000000000,星南,せっかくの機会だもの。\n挑戦してみるわ！,难得有机会。\n我要挑战一下！
0000000000000,{user},実際の運転とは、別物だと思いますよ。,我觉得和实际驾驶是两回事。
0000000000000,{user},正しい知識がない状態で、\nゲームに慣れないほうがよいかと。,在没有正确知识的情况下，\n最好不要习惯游戏。
0000000000000,星南,それも一理あるわね。,你说的也有道理。
0000000000000,星南,楽しみは実際に運転するときに、\n取っておくことにしましょう。,那就把乐趣留到\n实际驾驶的时候吧。
info,adv_pevent_001_jsna_activity_018-01.txt,,
译者,deepseek-chat,,