id,name,text,trans
0000000000000,千奈,先生っ、わたくし悩んでいますの！\nどうか相談に乗ってくださいませっ！,老师，我有些烦恼！\n请务必听我倾诉一下！
0000000000000,{user},よろこんで。どうしました？,当然可以。怎么了？
0000000000000,千奈,わたくしがライブをすることになった、\nハロウィンステージのことですわ。,是关于我要参加的\n万圣节舞台演出的事情。
0000000000000,{user},レッスンは順調だと聞いていますが。,听说你的练习进行得很顺利。
0000000000000,千奈,はいっ！　歌詞も振り付けも、\nしっかり覚えましたわ！,是的！歌词和舞蹈动作\n我都已经牢牢记住了！
0000000000000,{user},なんと……以前はあれほど\n苦労していたのに。,真是……以前你还那么\n辛苦呢。
0000000000000,{user},成長していますね。,你成长了不少啊。
0000000000000,千奈,うふふっ、\nありがとうございます、先生。,呵呵，\n谢谢您，老师。
0000000000000,千奈,ですが……わたくしが今回、\n悩んでいるのは……,但是……这次我烦恼的是……
0000000000000,千奈,歌詞や振り付けを覚えること――\nでは、ないのです。,并不是记住歌词和舞蹈动作——
0000000000000,千奈,ステージでハロウィンの楽しさを……\nどう表現したらいいのか、と。,而是如何在舞台上表现出\n万圣节的乐趣……
0000000000000,千奈,映像や本で、色々と\n勉強してはみたものの……,虽然我通过影像和书籍\n做了很多学习……
0000000000000,千奈,あまり上手くいってはおりませんの。,但效果并不太好。
0000000000000,{user},倉本さん。\nアイドルのステージとは、ただ……,仓本同学。\n偶像的舞台并不是……
0000000000000,{user},振り付け通りに踊り、\n歌詞の通りに歌う――,只是按照舞蹈动作跳，\n按照歌词唱——
0000000000000,千奈,――そういうものでは、\nありませんものね。,——并不是那样的，对吧。
0000000000000,千奈,わたくしの心が、表現したいものを\n理解していませんと。,我的心还没有理解\n想要表达的东西。
0000000000000,{user},その通り。では、ハロウィンを\nより深く理解しましょう。,没错。那么，让我们更深入地\n理解万圣节吧。
0000000000000,千奈,はいっ、先生！　\nどうすればよろしいのでしょう？,好的，老师！\n我该怎么做呢？
0000000000000,{user},ハロウィン本番よりも前……\nできればすぐにでも。,在万圣节正式演出之前……\n最好是马上。
0000000000000,{user},この家でハロウィンの練習パーティを\n開きましょう。,我们在这家里举办一个\n万圣节练习派对吧。
0000000000000,千奈,あらっ……なんだか楽しそうですわ。,哎呀……听起来很有趣呢。
0000000000000,{user},こんなこともあろうかと、\n倉本家の皆様とは打ち合わせ済みです。,为了以防万一，我已经和\n仓本家的各位商量好了。
0000000000000,倉本家のメイド,パーティの準備は、\n我々にお任せください。,派对的准备\n就交给我们吧。
0000000000000,{user},お手本ライブをしていただく、\n<em\=>アーティスト</em>の手配はこちらで。,我会安排一位<em\=>艺术家</em>\n来做示范演出。
0000000000000,千奈,まぁっ！　まぁっ！,哇！太棒了！
0000000000000,千奈,なにもかもが、ものすごい勢いで\n決まっていきますわ……！,一切都以惊人的速度\n决定了……！
0000000000000,倉本家のメイド,お嬢様、お友達を誘ってみては\nいかがでしょう？,小姐，要不要邀请\n您的朋友们来呢？
0000000000000,千奈,いいですわね！　\nきっと喜んでいただけますわっ！,好主意！\n他们一定会很高兴的！
0000000000000,{user},仮装イベントの時間も設けましょう。,我们还可以安排一个\n变装活动的时间。
0000000000000,千奈,まあ……まるで本物の\nハロウィンのよう！,啊……简直就像真正的\n万圣节一样！
0000000000000,{user},レッスンは本番のように。\n本番はレッスンのように、です。,练习要像正式演出一样。\n正式演出要像练习一样。
0000000000000,千奈,はいっ、先生！,是的，老师！
0000000000000,千奈,この素敵なレッスンでわたくし――,通过这次精彩的练习，我——
0000000000000,千奈,ハロウィンを理解してみせますともっ！,一定会理解万圣节的精髓！
info,adv_cidol-kcna-3-002_01.txt,,
译者,deepseek-chat,,