id,name,text,trans
0000000000000,{user},今日は河原で過ごしたいとのこと\nですが、そんな近場でいいんですか？,今天想在河边度过吗？\n不过，这么近的地方可以吗？
0000000000000,星南,息抜きだからって、いつもどこかに\n出かける必要はないでしょう？,放松一下，不一定总要去远的地方吧？
0000000000000,星南,川の流れを見ながらぼんやりする\nのも、いいんじゃない？,看看河流，发发呆\n也不错吧？
0000000000000,{user},ではせめて、なにかコンビニで\n買ってきましょうか。,那么至少去便利店\n买点东西吧。
select,,スナック菓子でも,零食也好
select,,ジュースでも,饮料也好
select,,雑誌でも,杂志也好
0000000000000,{user},アウトドアで食べると、\n不思議と味が変わった気がしますよ。,在户外吃东西，\n感觉味道会不一样哦。
0000000000000,星南,ライブの控室でも\n似たような経験があるわ。,在演出后台\n我也有类似的体验。
0000000000000,星南,そのときとどう違うのか、\n試してみようかしら。,试试看有什么不同吧。
0000000000000,{user},落ち着いて過ごすには、\nそれくらいがいいでしょう。,为了放松\n这样正合适。
0000000000000,星南,じゃあ私がペットボトル1本、\nあなたが2本ね。,那我带一瓶矿泉水，\n你带两瓶吧。
0000000000000,{user},……それは、どうしてですか？,……这是为什么呢？
0000000000000,星南,あなたの話をたくさん聞きたいのよ。\nいいでしょう？,我想多听听你的故事。\n可以吗？
0000000000000,星南,……川辺でわざわざ雑誌を読むの？,……专门在河边看杂志？
0000000000000,{user},普段しないでしょう？,平时不会这么做吧？
0000000000000,星南,まあ、なにかきっかけがないと\nしないでしょうね。,嗯，没有什么契机的话\n确实不会。
0000000000000,{user},これがそのきっかけです。,这就是那个契机。
0000000000000,星南,ふふ。なんでもやらせたがるのね。\nそれがプロデューサーなのかしら。,呵呵。什么都想让人尝试啊。\n这就是制作人吗？
info,adv_pevent_001_jsna_activity_019.txt,,
译者,gpt-4o-2024-05-13,,