id,name,text,trans
0000000000000,{user},少し時間はかかりましたが……\n結構集まってきましたね。,虽然花了一些时间……\n但是已经收集了不少了呢。
0000000000000,星南,そうね。ここまでで、\n参加賞はもらえるみたい。,是啊。到现在为止，\n好像已经可以拿到参与奖了。
0000000000000,星南,ただ、さっき気が付いたのだけれど……,不过，我刚才发现了……
0000000000000,{user},残りのスタンプは遠いですね。\n商店街から離れてしまいます。,剩下的印章离得很远呢。\n要离开商店街了。
0000000000000,星南,1日潰す覚悟がいりそうね。\nあなたに決めてもらいましょうか。,看来需要花费一天的时间了。\n你来决定吧。
select,,最後まで\nやりましょう,坚持到最后\n继续做下去
select,,そろそろ\n引き際かと,差不多了\n该打住了
0000000000000,星南,フフ、あなたなら\nそう言うと思っていたわ。,呵呵，我就知道\n你会这么说。
0000000000000,星南,これで最後のスタンプ――\nコンプリートよ！,这就是最后一个印章——\n收集完毕！
0000000000000,{user},そういえば、コンプリートの景品は\n何なのですか？,说起来，收集完成的奖品\n是什么呢？
0000000000000,星南,たしかに、景品の内容はあまり確認して\nなかったわね。ええっと……,确实，我也没怎么确认奖品的内容。\n嗯……让我看看……
0000000000000,星南,商店街のお店で使える食事券だそうよ。\nうまい導線づくりじゃない？,好像是可以在商店街使用的餐券。\n很好的引流手段，不是吗？
0000000000000,星南,参考にしたいしお腹もすいたから、\n食べて帰りましょうか。,既然想参考他们的做法，而且我也饿了，\n我们去吃点东西再回去吧。
0000000000000,星南,フフ、あなたなら\nそう言うと思っていたわ。,呵呵，我就知道\n你会这么说。
0000000000000,星南,これで最後のスタンプ――\nコンプリートよ！,这就是最后一个印章——\n收集完毕！
0000000000000,{user},……星南さん、悪いお知らせです。\n先程ホームページを見たところ……,……星南小姐，有个坏消息。\n刚刚看了下官网……
0000000000000,{user},コンプリート景品は\n品切れだそうです……！,收集完成的奖品\n好像已经没了……！
0000000000000,星南,そ、そんな……\nこんなに時間をかけたのに……！？,什么，怎么会……\n我们花了这么多时间……！？
0000000000000,{user},本当に、残念です……が。\n思い出にはなりましたね。,真的很遗憾……不过。\n也算是留下了回忆呢。
0000000000000,星南,ふふっ……前向きなのね。,呵呵……你倒是挺乐观的。
0000000000000,{user},もともと数日をまたぐもの\nなんでしょう。,本来这活动就应该分几天完成的。
0000000000000,{user},明日もレッスンはありますし、\n今日はここまでにしておきましょう。,明天还有课程，\n今天就到这里吧。
0000000000000,星南,優先順位は明確ということね。,优先级很明确呢。
0000000000000,星南,じゃあ残りは、次の休みにしましょう。\n……忘れないでね？,那剩下的就留到下次休息日吧。\n……别忘了哦？
info,adv_pevent_001_jsna_activity_017-02.txt,,
译者,gpt-4o-2024-05-13,,