id,name,text,trans
0000000000000,千奈,先生っ！　部屋まできていただいて、\nなんだか奇妙なのですけれど……,老师！您能来我房间，\n真是有点奇妙……
0000000000000,千奈,倉本千奈！　温泉休暇から、\nただいま戻りましたわっ！,仓本千奈！温泉假期结束，\n我回来了！
0000000000000,{user},おかえりなさい、倉本さん。\nゆっくり休めましたか？,欢迎回来，仓本小姐。\n休息得好吗？
0000000000000,千奈,はいっ！　心も身体も、\nばっちり元気になりましたわっ！,是的！身心都完全恢复了！
0000000000000,{user},それはよかった。\n心配がひとつ、減りましたよ。,那就好。\n少了一件担心的事。
0000000000000,千奈,うふふ……約束は、\n覚えていらっしゃいますわね？,呵呵……您还记得约定吧？
0000000000000,千奈,次は先生が、お休みを取る番ですわ。,下次该轮到您休息了。
0000000000000,{user},もちろん。遠慮なく――\n月末に、丸一日、休暇をいただきます。,当然。我不会客气的——\n月底我会休一天假。
0000000000000,{user},しっかりとリフレッシュしてきますよ。\n次なるプロデュースのために。,好好放松一下，\n为了下一次的培育。
0000000000000,千奈,むむ……先生のスケジュールには、\nさらなる改善が必要そうですわね。,嗯嗯……老师的时间安排\n似乎还需要进一步改进。
0000000000000,{user},お互い様です、倉本さん。\n我々は共に、夢を追っている身。,彼此彼此，仓本小姐。\n我们都是追梦人。
0000000000000,{user},望んで無理をしてしまうことも\nあるでしょう。ですが……,有时会因为追求梦想\n而勉强自己。不过……
0000000000000,千奈,長く無理を続けるのは……\nよいことではありませんわね。,长期勉强自己……\n不是好事。
0000000000000,千奈,先生も――わたくしも。,无论是您，还是我。
0000000000000,{user},この多忙な時期を乗り切ったら、\n改めて休暇を取りましょう。,度过这段繁忙期后，\n我们再安排休假吧。
0000000000000,千奈,はい……ぜひ！,好的……一定！
0000000000000,千奈,ふたりきりの温泉休暇――ですわね！,两人一起的温泉假期——对吧！
0000000000000,メイド,………………………………………………,………………………………………………
0000000000000,{user},（強烈なアイコンタクトが\n飛んできている……）,（强烈的眼神交流\n传过来了……）
0000000000000,{user},いえ、それは……やめておきましょう。,不，还是算了吧。
0000000000000,千奈,あら、どうしてですの？,哎，为什么呢？
0000000000000,{user},休暇のプランは、\n他にも色々あるからですよ。,休假的计划，\n还有很多其他选择。
0000000000000,{user},ご期待ください。,请期待吧。
0000000000000,千奈,まあっ、さすが先生！　\n楽しみにしていますわね！,哇，真不愧是老师！\n我很期待！
0000000000000,千奈,そうですわっ、\nたったいま思いついたのですけれど――,对了，\n我刚刚想到一个主意——
0000000000000,千奈,この家に、先生のお部屋を作る……\nというのはいかがでしょう？,在这个家里给老师您\n做个房间……怎么样？
0000000000000,{user},えっ？,哎？
0000000000000,千奈,そうすれば、先生の移動時間が\nぐーっと減らせますわ。,这样的话，老师的通勤时间\n就能大大减少。
0000000000000,千奈,わたくしも、いまよりずっと長く\n先生と一緒にいられますし……,我也能比现在更长时间\n和老师在一起……
0000000000000,千奈,我ながら……\n良いアイデアだと思いますの。,我觉得……\n这是个好主意。
0000000000000,{user},ええと……そうですね。\n大変ありがたいご提案ですが……,嗯……是的。\n这是个非常感谢的提议，不过……
0000000000000,メイド,………………………………………………,………………………………………………
0000000000000,{user},倉本さんの一存で、急に決められる\nことでは……ないのでは？,仓本小姐，这种事\n您一个人决定不了吧……
0000000000000,千奈,ふむむ……それもそうですわね。,嗯……确实是这样。
0000000000000,千奈,かしこまりました、先生。,明白了，老师。
0000000000000,千奈,このお話は、\nいったん保留といたしましょう。,这个话题，\n暂时搁置吧。
0000000000000,千奈,続きは、<em\=>しかるべきとき</em>に、改めて。,等到<em>合适的时候</em>，再重新讨论。
0000000000000,千奈,わたくしから、\nさせていただきますわねっ♪,到时候由我\n再提出来♪
info,adv_cidol-kcna-3-005_03.txt,,
译者,gpt-4o-2024-05-13,,