id,name,text,trans
0000000000000,あさり先生,十王さんは、学園トップの実力を持つ\nアイドルです。,十王同学是学园里最有实力的\n偶像之一。
0000000000000,あさり先生,当然、周囲からの期待や注目を集め、\nお仕事の機会も多いことでしょう。,当然，她会受到周围的期待和关注，\n工作机会也会很多吧。
0000000000000,星南,ありがたいことに、その通りですね。,非常感谢，确实如此。
0000000000000,あさり先生,しかし、だからこそ十王さんには\n合わないお仕事が来るかもしれません。,但是，正因为如此，可能会有\n不适合十王同学的工作。
0000000000000,あさり先生,そんなとき、プロデューサーとして\nどのように対応しますか？,那种时候，作为制作人\n你会怎么应对呢？
select,,それでも\n引き受けます,即使如此\n也会接受
select,,断ります,拒绝
select,,仕事内容の変更を\n求めます,要求更改\n工作内容
0000000000000,{user},一見、合わないと思っても、\nそれが星南さんにとって必要なことや、,即使看起来不合适，\n如果那是星南同学需要的，
0000000000000,{user},星南さんがやりたいことであるならば\n断る理由はありません。,或者是星南同学想做的\n就没有拒绝的理由。
0000000000000,星南,フフ、いい心意気ね。\n……でも、もし失敗してしまったら？,呵呵，很好的觉悟呢。\n……但是，如果失败了怎么办？
0000000000000,{user},そうならないように調整するのが\nプロデューサーの仕事です。,调整到不失败是\n制作人的工作。
0000000000000,{user},それに星南さんの場合は、少しくらい\n失敗してもそれはそれでおいしいので。,而且星南同学的话，就算稍微\n失败了也没关系。
0000000000000,あさり先生,うんうん。しっかりと、十王さん\n自身に向き合えているみたいですね！,嗯嗯。看起来你能好好\n面对十王同学！
0000000000000,{user},合わない仕事よりも\n合う仕事をすべきです。,比起不合适的工作\n更应该做合适的工作。
0000000000000,星南,当然、私もそれが正しいと思うわ。\nだけど、学園の代表として……,当然，我也觉得那是正确的。\n但是，作为学园的代表……
0000000000000,星南,どんな仕事にも挑戦する姿勢は\n見せたいわね。,我也希望展现挑战\n任何工作的态度。
0000000000000,{user},もちろん星南さんの意向を\n尊重します。,当然会尊重\n星南同学的意向。
0000000000000,{user},うまく調整するので\n任せてください。,我会好好调整，\n请放心交给我吧。
0000000000000,あさり先生,素晴らしい！　しっかり\n十王さんのことを考えてますね！,太好了！ 你真的在为\n十王同学着想呢！
0000000000000,星南,えっ……\nそれは、本末転倒ではないかしら？,诶……\n那不是本末倒置吗？
0000000000000,星南,求められているのは、\nその仕事をできる人、でしょう？,他们需要的，\n是能做好那份工作的人，对吧？
0000000000000,{user},おっしゃる通りですが、星南さんが\n指名されたのにも理由があるはずです。,您说得没错，但星南同学\n被指名一定有其理由。
0000000000000,{user},そこをすり合わせれば、\nお互いが望む形にできるでしょう。,只要调整好，\n就能实现双方的愿望。
0000000000000,星南,なるほど……その望む形には、\n私が実現可能かも含まれている、と。,原来如此……那种愿望的实现，\n也包括我能做到的可能性。
0000000000000,あさり先生,茨の道になるとは思いますが……\n諦めない姿勢はとってもいいですね！,我认为这条路会很艰难……\n但不放弃的态度非常好！
info,adv_pevent_001_jsna_school_003.txt,,
译者,gpt-4o-2024-05-13,,