id,name,text,trans
0000000000000,{user},本日はトークイベントです。\nお渡しした相手の資料は……,今天是谈话活动。\n交给你的对方的资料……
0000000000000,咲季,もちろん読んでいるわ。他にも\n色々調べてあるから、大丈夫よ。,当然读过了。我还\n查了很多其他资料，没问题的。
select,,凄いですね,真厉害啊
select,,色々、とは？,查了很多，是指？
select,,自信満々\nですね,你真是自信满满\n呢
0000000000000,咲季,ふへへぇ……\nわかってるじゃない～。,嘿嘿……\n你这不是很懂嘛～。
0000000000000,{user},身体作りに関して議論に発展した。\nふたりの熱弁が好評だったみたいだ。,话题发展到了身体塑造方面。\n两个人的热情演讲似乎很受欢迎。
0000000000000,咲季,あなたも気づかなかった運動のこと。\nま、わたしの得意分野ね。,连你都没注意到的运动方面。\n嘛，这是我的强项呢。
0000000000000,{user},身体作りに関して議論に発展した。\nふたりの熱弁が好評だったみたいだ。,话题发展到了身体塑造方面。\n两个人的热情演讲似乎很受欢迎。
0000000000000,咲季,自身が持てるまで準備しただけ。\nさ、行くわよ。,我只是准备到有自信为止。\n好了，我们走吧。
0000000000000,{user},身体作りに関して議論に発展した。\nふたりの熱弁が好評だったみたいだ。,话题发展到了身体塑造方面。\n两个人的热情演讲似乎很受欢迎。
info,adv_pevent_002_hski_sales_4-002-02.txt,,
译者,deepseek-chat,,