id,name,text,trans
0000000000000,{user},今日は河原で過ごしたいとのこと\nですが、そんな近場でいいんですか？,今天想在河边度过\n不过，这么近的地方真的可以吗？
0000000000000,星南,息抜きだからって、いつもどこかに\n出かける必要はないでしょう？,既然是放松，也没必要总是\n去什么特别的地方吧？
0000000000000,星南,川の流れを見ながらぼんやりする\nのも、いいんじゃない？,看着河水发呆\n不也挺好的吗？
0000000000000,{user},ではせめて、なにかコンビニで\n買ってきましょうか。,那至少，我去便利店\n买点东西来吧。
select,,スナック菓子でも,零食也行
select,,ジュースでも,果汁也行
select,,雑誌でも,杂志也行
0000000000000,{user},アウトドアで食べると、\n不思議と味が変わった気がしますよ。,在户外吃的话，\n总觉得味道会变得不一样呢。
0000000000000,星南,ライブの控室でも\n似たような経験があるわ。,在演唱会的休息室里\n也有过类似的经历。
0000000000000,星南,そのときとどう違うのか、\n試してみようかしら。,那时候和现在有什么不同，\n不如试试看吧。
0000000000000,{user},落ち着いて過ごすには、\nそれくらいがいいでしょう。,想要平静地度过，\n这样应该不错吧。
0000000000000,星南,じゃあ私がペットボトル1本、\nあなたが2本ね。,那我拿一瓶，\n你拿两瓶吧。
0000000000000,{user},……それは、どうしてですか？,……这是为什么呢？
0000000000000,星南,あなたの話をたくさん聞きたいのよ。\nいいでしょう？,因为我想多听听你说话。\n可以吗？
0000000000000,星南,……川辺でわざわざ雑誌を読むの？,……特意在河边看杂志？
0000000000000,{user},普段しないでしょう？,平时不会这么做吧？
0000000000000,星南,まあ、なにかきっかけがないと\nしないでしょうね。,嗯，没什么契机的话\n确实不会呢。
0000000000000,{user},これがそのきっかけです。,这就是那个契机了。
0000000000000,星南,ふふ。なんでもやらせたがるのね。\nそれがプロデューサーなのかしら。,呵呵。你总是想让我尝试各种事情呢。\n这就是制作人的风格吗？
info,adv_pevent_001_jsna_activity_019.txt,,
译者,deepseek-chat,,