id,name,text,trans
0000000000000,咲季,……プロデューサー。,……制作人。
0000000000000,咲季,わたしを連れていきたい場所って、\nここ……？,你想带我来的地方是……\n这里吗？
0000000000000,{user},はい。アニメイトです。,是的。这里是Animate。
0000000000000,咲季,それは、看板を見ればわかるわよっ！,这看招牌就知道了！
0000000000000,咲季,行き先も目的も、\n教えてくれないんだもの。,你既不告诉我目的地，也不告诉我目的。
0000000000000,咲季,トレーニング施設にでも\n連れて行ってくれるのかと思ったわ！,我还以为你要带我去训练设施呢！
0000000000000,{user},それは失礼しました。,那真是失礼了。
0000000000000,咲季,まあ、いいわ。\n言い出せなかったんでしょう？,算了，没关系。\n你是不好意思说吧？
0000000000000,咲季,まったく、プロデューサーったら――,真是的，制作人——
0000000000000,咲季,わたしと遊びたかったなら、\nそう言いなさいよね！,如果你想和我玩，就直接说嘛！
0000000000000,{user},はい？,嗯？
0000000000000,咲季,今日はレッスンも終わったし、\n断る理由もないわ。,今天课程已经结束了，\n我也没有拒绝的理由。
0000000000000,咲季,たまには、付き合ってあげるわよ！,偶尔陪你一下也没问题啦！
0000000000000,{user},ありがとうございます。\nでは、いきましょうか。,谢谢你。\n那我们走吧。
0000000000000,咲季,はじめて来たけど、すごいわね……,第一次来这里，真厉害……
0000000000000,咲季,こんなにたくさん漫画があるなんて！,竟然有这么多漫画！
0000000000000,咲季,あ、この漫画……\nスポーツのお話みたいね！,啊，这本漫画……\n好像是关于运动的故事！
0000000000000,{user},店員さんのおすすめのようですね。\nこちらに手書きのポップがありますよ。,看起来是店员推荐的。\n这儿有手写的推荐标签。
0000000000000,咲季,すごい熱量ね。\nここまで人を夢中にさせるなんて……,真是热情啊。\n能让人这么着迷……
0000000000000,咲季,どんなお話なのか、気になるわ！,我很好奇是什么故事呢！
0000000000000,咲季,ねえ、プロデューサー！\nこれはなにかしら！,喂，制作人！\n这是什么！
0000000000000,咲季,小さな衣装がたくさんあるわよ！,有好多小衣服！
0000000000000,{user},これは、ぬいぐるみ用の衣装ですね。,这是给玩偶穿的小衣服。
0000000000000,{user},いろいろな作品のキャラクターの衣装を\nぬいぐるみに着せられるみたいです。,好像可以给玩偶穿上各种作品的角色服装。
0000000000000,咲季,これ全部、キャラクターの衣装なの！？,这些都是角色的衣服吗！？
0000000000000,咲季,すごいわ。こんなにいろんな衣装を\n着られるなんて羨ましいじゃない……！,真厉害。能穿这么多种衣服，真让人羡慕……！
0000000000000,咲季,キャラクターグッズって、\nこんなにたくさんあるのね……！,角色周边竟然有这么多种类……！
0000000000000,咲季,学校で使うもの、\nひと通り揃えられちゃいそうだわ！,学校用的东西，\n好像都能在这里买齐呢！
0000000000000,咲季,プロデューサー、階段の壁に\nいろんなキャラクターがいるわよ！,制作人，楼梯的墙上\n有好多角色！
0000000000000,咲季,最上階まで、登ってみましょう！,我们爬到最顶层去看看吧！
0000000000000,{user},（さすが咲季さん。\n全力でアニメイトを楽しんでいる）,（不愧是咲季。\n全力享受着Animate）
info,adv_cidol-hski-3-006_01.txt,,
译者,gpt-4o-2024-05-13,,