id,name,text,trans
0000000000000,{user},――ごちそうさまでした。\nお弁当、とてもおいしかったです。,――谢谢款待。\n便当非常美味。
0000000000000,莉波,よかったぁ……\n作ってきたかいがあったよ。,太好了……\n我做的便当没白费。
0000000000000,莉波,せっかく来たんだし、きみにも\nリフレッシュしてもらいたかったから。,难得来一趟，我也想让你\n好好放松一下。
0000000000000,莉波,自然の中で食べるごはんって、\n特別おいしく感じるよね。,在大自然中吃饭，\n感觉特别美味呢。
0000000000000,{user},そうですね。,是啊。
0000000000000,{user},姫崎さんの作ってくださったご飯が\nおいしいのはもちろんですが。,当然，姬崎同学做的饭\n本身就很美味。
0000000000000,莉波,ふふっ、ありがとう。,呵呵，谢谢。
0000000000000,莉波,ここ、すごくいい場所だね。,这里真是个不错的地方。
0000000000000,莉波,風の音とか、鳥の鳴き声、\n木が揺れる音――,风声、鸟鸣、\n树木摇曳的声音――
0000000000000,莉波,自然の音に包まれた場所にいると、\n地元を思い出すなぁ。,被自然的声音包围着，\n让我想起了家乡。
0000000000000,莉波,なんだか……懐かしい。,总觉得……有点怀念。
0000000000000,莉波,ねえ、ちょっと歩こっか。,喂，我们稍微走走吧。
0000000000000,莉波,のんびり、お散歩しよう。,悠闲地散散步。
0000000000000,莉波,見て見て、{user}くん！,快看，{user}君！
0000000000000,莉波,あっちの方に、小さな魚がいるよ！,那边有小鱼哦！
0000000000000,{user},どこですか？,在哪里？
0000000000000,莉波,ほら、あの岩の陰のあたり。,你看，那块岩石的阴影附近。
0000000000000,莉波,川に落ちないように、気を付けて。\nそっとね。,小心别掉进河里。\n轻轻地。
0000000000000,{user},本当だ、小さくてかわいらしいですね。,真的，小小的很可爱呢。
0000000000000,莉波,でしょ？　ここの川、綺麗なんだね。,对吧？这里的河水真清澈。
0000000000000,莉波,子どもの頃だったら、\n川遊びとかもしちゃってたかも。,如果是小时候的话，\n我可能会在这里玩水。
0000000000000,{user},童心にかえって、川で遊ぶのも\nいいかもしれませんね。,回归童心，在河里玩\n或许也不错。
0000000000000,莉波,今の時期はきっと少し冷たいし、\n風邪ひいちゃうよ。,现在这个季节水肯定有点冷，\n会感冒的。
0000000000000,莉波,川遊びするなら、大きなタオルとか\nいろいろ用意しないとね。,如果要玩水的话，\n得准备大毛巾什么的。
0000000000000,{user},そうですね。\nではまた、別の機会に。,是啊。\n那下次再说吧。
0000000000000,莉波,ふふっ……うん、また今度だね。,呵呵……嗯，下次吧。
0000000000000,莉波,今日は、きみの提案通りにここに来て\n正解だったかも。,今天听你的建议来这里，\n真是对了。
0000000000000,莉波,心がすっかり、癒されちゃった。,心情完全被治愈了。
0000000000000,莉波,このあたり、あんまり\n来たことなかったけど……,这附近，我很少来……
0000000000000,莉波,向こうの方には、何があるんだろうね。,那边会有什么呢？
0000000000000,莉波,あそこに建物があるけど……\n誰か住んでるのかな？,那边有栋建筑……\n有人住吗？
0000000000000,{user},調べてみましょうか。\nこのあたりにある建物は――,我们查一下吧。\n这附近的建筑是――
0000000000000,{user},……温泉のようですね。,……好像是温泉。
0000000000000,莉波,温泉……！？,温泉……！？
info,adv_cidol-hrnm-3-004_02.txt,,
译者,deepseek-chat,,
