id,name,text,trans
0000000000000,星南,美鈴は今までずっと月村手毬さんに\nチョコをあげてきたの？,美铃到现在一直都给月村手毬\n送巧克力吗？
0000000000000,美鈴,はい。毎年、手作りのものを。,是的。每年都会亲手做。
0000000000000,星南,これまでどんなチョコを作ってきたの？\nぜひ参考に聞かせて頂戴。,你以前都做过什么巧克力呢？\n请一定要告诉我，好让我参考一下。
0000000000000,美鈴,……そうですね。,……这个嘛。
0000000000000,美鈴,まりちゃんは甘い物が大好きなのですが\nいつも我慢しているんです。,小毬很喜欢甜的东西，不过\n她总是忍着不吃。
0000000000000,美鈴,バレンタインの日くらいは、\nなんの心配もなく……,至少在情人节这天，\n希望她能无忧无虑地……
0000000000000,美鈴,チョコレートを食べてほしい。\nですから……まずは、献立を作ります。,吃巧克力。\n所以……首先，我会制定菜单。
0000000000000,美鈴,バレンタイン前後の摂取カロリーを\n抑えてあげるんです。,在情人节前后的摄入卡路里\n我会帮她控制。
0000000000000,星南,前後の食事もプロデュースすることで、\nアイドルもチョコを楽しめる――！,通过培育前后的饮食，\n偶像也能享受巧克力！
0000000000000,美鈴,それと……,还有……
0000000000000,美鈴,乳製品を足す量にも気を付けることで、\n吹出物を防ぐこともできます。,注意控制乳制品的量，\n也可以防止长痘痘。
0000000000000,星南,素敵な工夫ね。渡す相手への想いが\n伝わってくるわ。,真是很棒的巧思呢。把心意传递给\n对方的感觉都能感受到。
0000000000000,星南,――ありがとう、美鈴。,——谢谢你，美铃。
0000000000000,星南,私も負けてはいられない。,我也不能输给你。
0000000000000,星南,まずはことねの理想の献立について、\n栄養士に相談しましょう。,首先就琴音理想的菜单，\n我去咨询一下营养师吧。
0000000000000,星南,待っていて！　ことね！,等着我！琴音！
0000000000000,美鈴,……行ってしまいました。\nすこし心配ですが……,……走掉了。\n虽然有点担心……
0000000000000,美鈴,ふふ……どうなることやら。,呵呵……不知道会怎样呢。
info,adv_csprt-2-0042_02.txt,,
译者,gpt-4o,,
