id,name,text,trans
0000000000000,麻央,まだ結構、雪が残ってますね。,还剩下不少雪呢。
0000000000000,{user},先日の残雪ですね。\n今日は晴れてよかったです。,是前几天下的雪呢。\n今天晴天真好。
0000000000000,麻央,そうですね。ひな人形も、\n外に飾れましたし。,是啊。也把雏人偶\n摆到外面去了。
0000000000000,女の子,わぁ、おひなさまだー。すごーい！,哇，是雏人偶！好厉害！
0000000000000,麻央,ありがとう。今日はめいっぱい、\n楽しんでいってね。,谢谢。今天尽情地\n玩个痛快吧。
0000000000000,{user},お客さん、増えてきましたね。\n盛況なイベントになりそうです。,客人越来越多了呢。\n看来会是个热闹的活动。
0000000000000,麻央,ミニステージとはいえ、\nちょっと緊張してきました……,虽然是个小舞台，\n但是有点紧张……
0000000000000,ことね,あ、いたいたー。麻央ちゃん先輩ー。,啊，找到了！麻央学姐！
0000000000000,麻央,――ことね。,——琴音。
0000000000000,ことね,カワイイことね後輩が、\n応援に来ましたよー。,可爱的琴音后辈\n来给你加油了哦。
0000000000000,{user},……麻央ちゃん先輩？,……麻央学姐？
0000000000000,麻央,こ、こら、ことね！\n人前で麻央ちゃん先輩はやめたまえ。,喂，琴音！\n别在人前叫我麻央学姐。
0000000000000,ことね,あはは。すみまセン……\n……って、麻央先輩、,哈哈，不好意思……\n……话说，麻央学姐，
0000000000000,ことね,ステージ衣装、すっごい、\n似合ってるじゃないですか！,这件舞台服，\n好适合你啊！
0000000000000,麻央,そ、そうかな？,是、是吗？
0000000000000,ことね,もうバッチリですよぉ。,简直是完美呢。
0000000000000,ことね,……ん、このひな人形って、\nもしかして、手作りですか？,……嗯，这个雏人偶，\n难道是手工做的吗？
0000000000000,麻央,ああ。プロデューサーと\nふたりで作ったんだ。,嗯。我和制作人\n一起做的。
0000000000000,ことね,へぇ……ん、んん～？\nこの三人官女って、なーんか、,哇……嗯，嗯嗯～？\n这个三人官女，好像，
0000000000000,ことね,あたしたちに似てまセン？,有点像我们呢？
0000000000000,麻央,ふふ、じつはね、ことねたちを\nモデルに作ったんだ。,呵呵，其实是以琴音你们\n为模型做的哦。
0000000000000,ことね,……あ、やっぱり。,……啊，果然。
0000000000000,麻央,なかなか、可愛くできてるだろう？,做得还挺可爱的吧？
0000000000000,ことね,あとで咲季と手毬にも\n見せてやろーっと。,等会儿也让咲季和手毬\n看看吧。
0000000000000,清夏,やっほー。まおっち先輩、\nことねっち～♪,嗨——麻央学姐，\n琴音——♪
0000000000000,リーリヤ,お待たせしましたっ。,让你们久等了。
0000000000000,麻央,あ、清夏。リーリヤも――,啊，清夏。莉莉娅也——
0000000000000,清夏,まおっち先輩のライブなんでー、\n応援にきましたっ！,因为是麻央学姐的演出，\n所以来给你加油了！
0000000000000,清夏,あたしたちで、まおっち先輩のライブ、\nめーっちゃ盛り上げちゃいますよ！,我们会让麻央学姐的演出，\n超级热闹的哦！
0000000000000,リーリヤ,……盛り上げちゃいます。,……一定会很热闹的。
0000000000000,麻央,……ありがとう、みんな。,……谢谢大家。
0000000000000,リーリヤ,ひな人形……カワイイです。\nアニメで観て、憧れてました。,雏人偶……好可爱哦。\n在动画里看到过，很向往呢。
0000000000000,{user},みなさん、せっかく、\n雛祭りの衣装で来てくださったので、,大家既然特意穿上了\n雏祭的服装，
0000000000000,{user},1つ、協力して頂けないでしょうか。,能请大家帮个忙吗？
0000000000000,ことね,……なんですかぁ？,……是什么呢？
0000000000000,{user},ライブの前に、ステージの衣装で\nグラビアの撮影をするのですが、,在演出前，我们要拍摄\n身着舞台服的写真，
0000000000000,{user},お内裏様のお相手役の、\nお雛様をして頂ければと。,希望能请你们当新郎新娘的\n女方，扮演雏人偶。
0000000000000,リーリヤ,……お雛様。,……雏人偶。
0000000000000,清夏,カッコイイまおっち先輩を、\n引き立てる役ですね！,是要扮演衬托帅气\n麻央前辈的角色呢！
0000000000000,{user},はい。お願いできますか？,好的。可以拜托你吗？
0000000000000,ことね,りょーかいしましたっ！\nお安いご用です！,了解！\n小菜一碟！
0000000000000,麻央,ありがとう、みんな。,谢谢大家。
0000000000000,麻央,ふふっ、それじゃあ早速、\n撮影に入ろうか、ボクのお姫様たち。,呵呵，那我们马上开始拍摄吧，\n我的公主们。
0000000000000,麻央,みんなー、今日は来てくれて、\n本当にありがとうー！,大家，今天能来这里，\n真的很感谢哦！
0000000000000,清夏,まおっち先輩、めーっちゃ、\nサイコーのライブでしたよー。,麻央前辈，今天的演唱会，\n真的太棒了。
0000000000000,ことね,チビっ子たち、みんな\n楽しそうでしたねっ！,小孩子们看起来\n都很开心呢！
0000000000000,リーリヤ,……とても、素敵でした。,……非常棒。
0000000000000,麻央,みんなも、一緒にステージを\n盛り上げてくれてありがとう。,谢谢大家一起\n让舞台更加精彩。
0000000000000,ことね,いえいえ。いつもお世話になってる、\n麻央先輩のためですしぃ。,不不不。为了一直照顾我们的\n麻央前辈嘛。
0000000000000,リーリヤ,……盛り上げ役の三人囃子、\n楽しかったです……。,……作为气氛组的三人组，\n很开心呢……。
0000000000000,清夏,それじゃ、あたしたちは、\n学園に戻りますねー。,那么，\n我们要回学校了哦。
0000000000000,麻央,ああ、また明日。\n今日は本当に助かったよ。,嗯，明天见。\n今天真是帮了大忙。
0000000000000,{user},いいライブでしたね。\n子供たちも喜んでいました。,真是一场好演唱会。\n孩子们也很开心。
0000000000000,麻央,ことねたちと、\nプロデューサーのおかげです。,多亏了琴音她们\n和制作人。
0000000000000,麻央,プロデューサーが声をかけて、\n集めてくれたんですよね？,是制作人招呼\n大家来的吗？
0000000000000,{user},みなさん、二つ返事で\nOKしてくれましたよ。,大家都毫不犹豫地\n答应了哦。
0000000000000,{user},普段から、寮の面倒をみてきた、\n麻央さんの人望です。,这都是平时麻央同学\n照顾宿舍的结果。
0000000000000,麻央,……そうなんだ。\n嬉しい……ですね。,……原来如此。\n真高兴……呢。
0000000000000,{user},そろそろ学園に戻りましょう。\n今日はゆっくり休んでください。,差不多该回学校了。\n今天好好休息吧。
0000000000000,麻央,ええ……あ、雪人形。,嗯……啊，雪人。
0000000000000,麻央,お雛様が、1つ、2つ、3つ、4つ。,有一个、两个、三个、四个娃娃。
0000000000000,麻央,これって、もしかして……\nボクたちの人形かな？,这该不会是……\n我们的人偶吧？
0000000000000,{user},たしかに、似てる気がしますね。,确实，感觉很像呢。
0000000000000,{user},麻央さんのライブを観て、子供たちが\n作ってくれたんでしょうか。,可能是孩子们看了麻央同学的演唱会\n后做的吧。
0000000000000,麻央,ふふっ、嬉しいなあ。溶けちゃうのは、\nちょっと、もったいないですけどね。,呵呵，真开心。虽然融化掉有点\n可惜呢。
0000000000000,麻央,写真に撮って、\nあとでみんなに送ろっと。,拍张照片，\n然后发给大家。
0000000000000,{user},名残雪が溶けてしまっても、\nきっと、今日のライブは――,即使残雪融化，\n今天的演唱会也一定会——
0000000000000,{user},子供たちの記憶に\n残るものになったと思います。,成为孩子们\n记忆中的一部分。
0000000000000,{user},今日のお客さんが、将来、\n初星を受験してくれるといいですね。,希望今天的观众，将来能报考\n初星学院。
0000000000000,麻央,ふふっ、そうですね。,呵呵，是啊。
0000000000000,麻央,未来の後輩たちに、初星の光を\n届けられていたら、嬉しいな。,如果能把初星的光芒\n传递给未来的后辈们，就好了。
0000000000000,麻央,あ……手、冷たくなっちゃいました。,啊……手都冻僵了。
0000000000000,{user},冷えてはいけません。\nカイロを――,不能受凉。\n暖宝宝——
0000000000000,麻央,大丈夫ですよ。,没关系的。
0000000000000,麻央,少しだけ、プロデューサーの\nポケット、貸してください。,可以借用一下制作人的\n口袋吗？
info,adv_cidol-amao-3-009_03.txt,,
译者,gpt-4o,,
