id,name,text,trans
0000000000000,星南,――そうやって。,――就是这样。
0000000000000,星南,生徒会の皆に、歌を聴いてもらって。\n感想や助言を求めて……,让学生会的大家听我的歌。\n寻求他们的感想和建议……
0000000000000,星南,新曲のレッスンに\n付きあってもらったの。,还让他们陪我一起练习新曲子。
0000000000000,{user},成果はありましたか？,有成果吗？
0000000000000,星南,……正直に言うけれど、\n曲の完成度はあまり変わらなかった。,……老实说，\n曲子的完成度并没有太大变化。
0000000000000,星南,技術がいきなり向上したり、\n<r\=ステータス>能力値</r>が急激に成長したり。,技术突然提高，\n<r\=ステータス>能力值</r>急剧增长。
0000000000000,星南,そういったことは、まったく。,这样的事，完全没有。
0000000000000,星南,だけど、胸を張って言えるわ。,但是，我可以自豪地说。
0000000000000,星南,成果はあった、と。,是有成果的。
0000000000000,星南,とても楽しかった、と。,而且非常开心。
0000000000000,星南,フフ……相変わらず、慣れないわね。,呵呵……还是不太习惯呢。
0000000000000,星南,数値で視えないものを\n言語化するのは。,用语言表达那些\n无法用数值表示的东西。
0000000000000,星南,私自身の実力は、\nなんら変わっていないはずなのに――,虽然我的实力\n应该一点都没变——
0000000000000,星南,どうしてかしら。,为什么呢。
0000000000000,星南,ちっとも負ける気がしないの。,一点也没有觉得会输。
0000000000000,{user},皆さんとは、どんな話を？,和大家聊了些什么？
0000000000000,星南,「かっこいいです」――\n「がんばってください」――,“很帅气”——\n“请加油”——
0000000000000,星南,「けしからん」「可愛らしいですわ」\n「必ず観に行きますね」――,“真是不可思议”“很可爱呢”\n“一定会去看的”——
0000000000000,星南,他愛もない会話ばかりよ。,都是些无关紧要的对话。
0000000000000,星南,たくさん、たくさん……\n応援してもらったわ。,很多很多……\n大家都在为我加油。
0000000000000,星南,ほんとうに……\n上手く言葉にできないのだけれど。,真的……\n虽然我说不好。
0000000000000,星南,かつての私に足りなかった、\n強力な武器を手に入れたような――,但就像是获得了过去的我所缺乏的\n强力武器一样——
0000000000000,星南,奇妙な手応えがあるの。,有一种奇妙的感觉。
0000000000000,星南,これって気のせいかしら？,这只是错觉吗？
0000000000000,{user},気のせいでも、いいのでは。,即使是错觉，也无妨。
0000000000000,星南,あら、先輩？　大切なライブを\n間近に控えたアイドルに――,哎，前辈？ 对即将迎接\n重要演出的偶像——
0000000000000,星南,掛ける言葉は、\nほんとうにそれでいいのかしら？,你真打算就这么说吗？
0000000000000,{user},『夢』などという曖昧なものを\n扱う仕事なんですから。,毕竟我们是在处理\n“梦想”这样模糊的东西。
0000000000000,{user},数値や言語で表わせる武器だけで\n挑むのは頼りないでしょう。,只靠数值和语言能表达的武器来\n挑战是靠不住的。
0000000000000,星南,そう、ね。少なくとも、私には……\nそこまでの才能はなかった。,是啊。至少对我来说……\n没有那样的天赋。
0000000000000,星南,なのに不思議。,可是很奇怪。
0000000000000,星南,いまは無根拠な自信が、\nいくらでも湧いてくる。,现在无缘无故的自信，\n怎么都冒出来。
0000000000000,星南,早く明日にならないかしら――\n早く歌いたくて仕方がないわ。,好想快点到明天——\n迫不及待想唱歌了。
0000000000000,星南,あなたも、楽しみにしていて頂戴。,你也要期待哦。
0000000000000,星南,きっと最高のライブにしてみせるから。,我一定会让这场演出成为最棒的。
info,adv_cidol-jsna-3-000_03.txt,,
译者,gpt-4o-2024-05-13,,