id,name,text,trans
message,咲季,お待ちどおさま、プロデューサー！,久等啦，制作人！
message,咲季,これが花海咲季特製、\nトップアイドル養成ごはん改よ！！,这就是花海咲季特制\n顶级偶像养成餐改良版！！
message,{user},おお……ついに完成したんですね。\nとても美味しそうだ。,哦哦……终于完成了啊。\n看起来超级美味。
message,咲季,えへへ～♪,嘿嘿～♪
message,咲季,見た目やにおいだけじゃなくて、\n食感や栄養バランスもばっちり。,不仅是卖相和香气，\n口感和营养搭配也都完美无缺哦。
message,咲季,毎日食べても飽きないよう、30通りの\nバリエーションがあるのよ。,为了避免吃腻，\n我还准备了30种不同搭配呢。
message,咲季,もちろん食べてもらう相手によって、\nさらにカスタマイズを加えるの。,当然还会根据用餐对象，\n进行个性化调整啦。
message,咲季,プロデューサーのためだけに\n作った、特製の献立っ♡,这可是专门为制作人\n量身定制的特别菜单哦♡
message,咲季,さ、食べて食べてっ♪,来，快尝尝看嘛♪
message,{user},いただきます、咲季さん。,那我开动了，咲季小姐。
message,{user},――ごちそうさまでした。\n素晴らしい味でしたよ。,——多谢款待。\n真是绝妙的味道。
message,咲季,ホント？　よかったぁ～～～～～♪,真的？太好了～～～～～♪
message,咲季,好みの味付けじゃなかったら、どうし\nようって……ハラハラしちゃったわ。,要是味道不合你口味的话\n我真不知道该怎么办……刚才紧张死了。
message,咲季,あ、その顔～。,啊，你这表情～。
message,咲季,改善前のメニューをさんざん食べさせて\nおいてって言いたそうね。,想说我之前让你试吃了那么多\n改良前的菜单是吧。
message,{user},いいえ、以前の献立も\n美味しかったですよ。ただ……,没有，之前的菜单\n也很美味。只是......
message,{user},気になったんです。,我有点在意。
message,{user},これほど一気に改善したのは、\nなにか理由があったのか、と。,突然做出这么大改进，\n是有什么特别原因吗？
message,咲季,先週、朝、起きたときにね。\nふと思いついたの。,上周，早上醒来的时候\n突然想到的。
message,咲季,ひらめいたっていうか、\n上手く言えないんだけど、さ。,说是灵光一闪也好，\n不太会形容啦。
message,咲季,あいつらに……あなたにも。美味しい\n料理を食べさせてあげたいな……って。,就是想让大家......包括你，\n都能吃上更美味的料理......
message,咲季,さっそく試作を重ねて……さっき、\nクラスメイトたちにもふるまってきた。,马上就开始反复试做......\n刚才还给同学们都尝过了。
message,咲季,大好評だったわ。手毬なんか、珍しく\nわたしに、ありがとう……って。,反响超棒哦。连手毬都破天荒\n对我说了谢谢呢。
message,咲季,元々、友達ではあったんだけど……\nもっと仲良くなれた気がする。,虽然我们本来就是朋友......\n但感觉关系更亲近了。
message,{user},……あなたは、どんどん欠点が\nなくなっていきますね。,......你的缺点正在\n一个个消失呢。
message,咲季,ふふ～♪　――そういうあなたは、\nなにか悩み事？　なんとなくだけど……,哼哼～♪ ——倒是你\n是不是有什么烦恼？总觉得......
message,咲季,担当アイドルの手料理を食べられて\n嬉しい～、幸せ～って。,能吃到负责偶像亲手做的料理\n很开心～很幸福～什么的。
message,咲季,それだけじゃなさそうに見えるわ。\nわたしで良ければ話してみなさい。,看起来不止是这样吧。\n不介意的话可以跟我说说哦。
message,咲季,担当アイドルに話すようなことでは\nないのですが……は、禁止よ。,虽然可能不适合跟担当偶像说......\n但是，禁止拒绝哦。
message,{user},お見通しですね。実は……授業で\nシミュレーションをしたんです。,被你看穿了啊。其实......\n上课时做了个模拟练习。
message,{user},担当アイドルにユニットを\n組ませるとしたら……という。,关于如果让负责偶像\n组队的话......这样的课题。
message,咲季,うんうん。,嗯嗯。
message,{user},シミュレーションをしてみて。\n改めて思い知ったんです。,做完模拟之后。\n我再次深刻认识到。
message,{user},咲季さんは、ユニット活動に\nきわめて高い適性があると。,咲季小姐你\n特别适合团体活动。
message,咲季,ははぁ～ん……それで複雑な\n気持ちになっちゃったのね。,原来如此......所以心情\n变得复杂起来了是吧。
message,咲季,ユニット活動の方が、\n私に合っていたんじゃないか。,在想我是不是\n更适合团体活动。
message,咲季,もっと上を目指せたん\nじゃないか、って。――図星でしょう。,是不是能取得更高成就\n之类的。——被我说中了吧？
message,咲季,あなたを叱るわ、プロデューサー。,我要批评你哦，制作人。
message,咲季,あなたが選んだソロアイドル・\n花海咲季を信じなさい！,请相信你亲手选拔的\n独立偶像·花海咲季！
message,咲季,わたしをここまで導いた、\nあなたのプロデュースを信じなさい！,请相信一路培养我至今的\n你的培育方式！
message,咲季,『頼れる仲間とユニットを組んでいる\n花海咲季』にだって――,就算是『和可靠伙伴组队\n的花海咲季』——
message,咲季,わたしは勝ってみせる！！！,我也一定会赢给你看！！！
message,{user},（あなたの<em\=>これ</em>が、どれだけ……\nユニットの武器になることか……だが）,（你这份斗志会成为......\n多么强大的团队武器啊......但是）
message,{user},思い出しました。ユニット適性が\nあるとわかっていて……,我想起来了。明明知道\n你有团队适应性......
message,{user},あなただけをスカウトした理由を。,却只招募你一个人的理由。
message,咲季,あら、気になるわね。\n教えなさいプロデューサー。,哎呀，真让人在意。\n快说呀制作人。
choice,,独占したかったから,因为想独占你
message,咲季,とっ……突然なにを言うのよ……,突、突然说什么呀......
message,咲季,もう……最初から……\nそんなことだろうと……思ってたわ。,真是的......我早就......\n猜到会是这种回答了......
message,咲季,――わたしも。,——我也是。
message,咲季,あなたを独占したい。,想要独占你。
message,咲季,だから……えっと……いいっ？,所以......那个......可以吗？
message,咲季,これからも、わたしだけを\nプロデュースしなさいっ♪,今后也请只\n培育我一个人哦♪
info,adv_cidol-hski-3-012_01.txt,,
译者,Pro/deepseek-ai/DeepSeek-V3,,
