id,name,text,trans
message,{user},咲季さん、\n今日もレッスンお疲れさまでした。,咲季同学，\n今天的训练也辛苦了。
message,咲季,あら、わざわざ迎えに来てくれたの？,哎呀，专程来接我吗？
message,{user},少し……話をしたかったので。,有些话……想和您说。
message,咲季,レッスンなら順調よ。\nダンスも歌も、ぐんぐん伸びているわ。,训练很顺利哦。\n舞蹈和歌唱都在飞速进步呢。
message,咲季,手毬とことねもね。,手毬和琴音也是。
message,咲季,すっごくわくわくする。\nわたし自身が大きく成長できて、,真是让人心潮澎湃。\n不仅我自己在飞速成长，
message,咲季,さらに強力なライバルが育っていく\nオマケ付きだなんて！,还附带培育出如此强劲的对手\n这样的额外收获！
message,咲季,あなたが合同レッスンを\n提案してくれたおかげ。,这都要感谢你提议\n进行联合训练。
message,咲季,なんってわたし好みの\nプロデュースプラン♪,完全就是我理想中的\n培育方案♪
message,{user},花海咲季の強力なユニット適性を、\n少しでも活用したかったんです。,我只是想充分发挥，\n花海咲季的团队适配性。
message,{user},まさかこれほどの効果があるとは……\nとても相性が良かったようですね。,没想到效果这么显著……\n看来大家配合得很默契呢。
message,咲季,その顔。ま～た悩んでいるん\nじゃないでしょうね？,这表情～又在烦恼\n什么事情对吧？
message,{user},いまにも溢れそうな想いがあるんです。\nP科の教えには反してしまいますが、,有满溢的思绪不吐不快。\n虽然违背了P科的教导，
message,{user},聞いていただけますか？,能听我说说吗？
message,咲季,ふっふっふ……,哼哼哼……
message,咲季,隠しごとは無駄だって、\nようやくわかってくれたみたいね。,终于明白隐瞒心事\n是白费力气了呢。
message,咲季,さあ、どうぞ。あなたの担当アイドル\nが、なんでも聞いてあげるわ。,来吧，尽管说。你的专属偶像\n会认真倾听的哦。
message,{user},先に言っておきますが、これから\n話すのは……悩みではなく、自慢です。,事先声明，接下来要说的\n不是烦恼……而是炫耀。
message,咲季,自慢？,炫耀？
message,{user},P科に入学する前、どんなアイドルを\nプロデュースするべきかと、,在进入P科之前，\n思考该培育哪位偶像时，
message,{user},生徒名簿を眺めていたとき、\n俺には無数の選択肢があった。,翻阅着学生名册，\n我眼前是数不尽的选项。
message,{user},数多の可能性があった。,无限的可能性。
message,咲季,その中から、\nあなたはわたしを選んだわ。,而你从其中\n选择了我呢。
message,{user},『花海咲季を選んだ俺』が、最強です。,「选中花海咲季的我」，是最强的。
message,咲季,――……わたしに似てきたわよ、\nプロデューサー。,——……越来越像我了呢，\n制作人。
message,{user},あなたと共にいると、\n誇り高い気持ちになる。,和您在一起时，\n总会涌起自豪感。
message,{user},胸を張って進んでいける。\n毎日が、楽しくて仕方がない。,能昂首挺胸地前进。\n每天都开心得不得了。
message,咲季,わたしもよ。\n窮地だらけの日々なのに……,我也是哦。\n明明每天都充满挑战……
message,咲季,振り返ると、笑っている記憶ばかり。,回想起来却全是欢笑。
message,咲季,シミュレーションなんて、\nするまでもないわ。,什么模拟推演，\n根本不需要做的。
message,咲季,これまでの現実で、\nはっきりとわかるもの。,迄今为止的现实，\n早已给出了明确答案。
message,咲季,『あなたにプロデュースされている\nわたし』こそが、最強よ。,「被你培育的我」\n才是最强的。
message,咲季,誰にも……神様にだって、\n違うとは言わせない。,谁都别想否认——\n就算是神明也不行。
message,咲季,プロデューサー。\nわたしたちで証明し続けましょう――,制作人。\n让我们继续证明吧——
message,咲季,あなたとわたしのペアこそが、\n世界最強なんだって！,你我的组合才是\n世界最强！
info,adv_cidol-hski-3-012_03.txt,,
译者,Pro/deepseek-ai/DeepSeek-V3,,
