id,name,text,trans
0000000000000,{user},星南さんは、クラスメイトや友人と\n休日を過ごすことはあるんですか？,星南，你平时会和同学或朋友一起\n度过假日吗？
0000000000000,星南,あまりないわね。,不太会呢。
0000000000000,星南,忙しいと思われているのかしら。\n私って、誘いにくいみたい。,可能是因为大家觉得我很忙吧。\n好像不太好意思邀请我。
0000000000000,{user},星南さんから誘ってみては？\n学友と親交を深めるのも大切ですよ。,那星南要不要主动邀请一下？\n和同学增进感情也很重要哦。
0000000000000,星南,それもそうね……\nどんなことに誘うのがいいかしら。,那倒也是……\n该邀请他们做些什么好呢。
select,,勉強会,学习会
select,,ショッピング,购物
select,,お泊り会,过夜派对
0000000000000,星南,そういえば、テスト前になると\n勉強会をしている子もいるみたいね。,说起来，好像有人在考试前\n会一起开学习会呢。
0000000000000,{user},お菓子や飲み物を持ち寄って、\n教え合うのは楽しいと思いますよ。,大家带些零食和饮料，\n互相教教，应该会很有趣哦。
0000000000000,星南,……もっと固い感じを想像していたわ。,……我原以为会是更正式一些的感觉。
0000000000000,星南,勉強をしながら、交流もできるなんて\nやらない理由がないくらいね。,一边学习一边交流，\n这理由简直无可挑剔啊。
0000000000000,星南,採用よ。今度、誰かを誘ってみるわ。,就这么定了。下次我也试着邀请一下。
0000000000000,星南,誰かと行く機会はなかったわね。\n服を買う時は、自分で選んでいるし。,我倒是没和别人一起去过。\n买衣服的时候都是自己选的。
0000000000000,{user},星南さんは自分に似合う服を\nよくわかっていると思いますが――,我觉得星南很了解\n什么样的衣服适合自己——
0000000000000,{user},新しい自分の魅力を見つけるには、\n人に選んでもらうのもいいのでは？,不过为了发现新的魅力，\n让别人帮你选衣服也不错哦？
0000000000000,星南,面白そうね。\nイメージを変えてみるのも悪くないわ。,听起来挺有趣的。\n换个形象也不错。
0000000000000,星南,それに、逆に私がその子の\n服を選んであげるのもいいわよね。,而且，我也可以反过来帮她\n选衣服，这也挺好的。
0000000000000,星南,フフフ……\nプロデュースのし甲斐がありそうだわ！,呵呵……\n感觉很值得去培养呢！
0000000000000,星南,いきなり誘うには、ハードルが\n高くないかしら……！？,可是，一下子邀请别人，\n会不会有点难啊……！？
0000000000000,{user},ですが、ぐっと距離を縮めるには\n良い機会になるかと。,不过，这可是个拉近距离的\n好机会哦。
0000000000000,星南,！　確かに一理あるわ。\nこの機会に、ことねを――,！　确实有道理。\n这次就邀请琴音——
0000000000000,{user},……誘い方には気を付けてください。,……邀请方式要注意哦。
0000000000000,星南,どっ、どういう意味かしら。,你、你这话是什么意思。
info,adv_pevent_001_jsna_activity_005.txt,,
译者,gpt-4o-2024-05-13,,